Let input vector be [ 5 1 1 ]. What is its magnitude?	Let an input vector be [ 5 1 1 ]. What is its magnitude?	What is the magnitude of an input vector?	Let output vector be [. 5 1 1 ]. What is its magnitude?	Let an input vector be [ 5 1 1 ] Then what is its magnitude?
If x = [ 4 4 ],what is [| x ||?	If x = [ 4 4], then what is || x ||?	If x = [4 4 ] then what is || x ||?	If x =[ 4 4 ], (| x ||,(?)?	If x = [ 4 4 ], what is || x ||?
What is the Euclidean length of [ 1 4 3]?	Calculate Euclidean length?	Explicitly find the Euclidean length of [ 1 4 3 ].	How can you find Euclidean length by their recursive commas (for example  1 4 3 spc, for example)?	Find the Euclidean length of [ 1 4 3 ].
What is the magnitude of the vector?	What is the magnitude of the vector 0 8 1?	What is the magnitude of the vector [ 0 8 1 ]?	What is the magnitude of vector [0 8 1 ]?	What is the magnitude of the vector (x)?
Graph the magnitude of [ 6 2 ].. Compute the magnitude of [ 1 ].	Compute the magnitude of [ 6 2 ] into 't'.	Calculate the magnitude of [ 6 and 2].	Calculate the magnitude of [ 8 [ 2]].	Compute the magnitude of [ 6 2 ].
How do you find Euclidian length by using equations without the symbol "M"?	Which Euclitian shape is best derived from the Euclidian length [ 5 3]?	Determine the Euclidian length of the Earth or the Sun with a distance of > 2 m. Find [ 5 3 ].	What is the epic length of Euclidian?	Find the Euclidian length of [ 5 3 ].
Let an input vector be [ 3 1 3 ]. Why is its magnitude is significant?	Let input vector be [ 3 1 3 ] and its magnitude. What is its magnitude?	What is the magnitude of a input vector?	Let input vector be [ 3 1 3 ]. What is its magnitude?	Let an input vector be [3 1 3 ]. What is its magnitude?
If x = [ 1 0 3 ], what is || x ||?	If x = [ 1 0 3 ], what is x ||?	When x = [ 1 0 3 ], what is "x || "?	If "x" = [1 0 3 ], then what is x ||?	Is [1 0 0  () ] x|. 1 0 3?
Find the Euclidean length of [ 4 4 1 ].	Find Euclidean length of [ 4 4 1 ].	Finding the Euclidean length of [ 4 4 1].	Calculate Euclidean length of [4 4 1 ]. If you calculate long form, get the length.	Calculate Euclidean length of * 4 [ 41].
What is the magnitude of a vector?	What is a magnitude of matrix vector [ 1 5]?	What is the magnitude of vector [ 1 5 ]?	What is magnitude of vectors?	How much is the magnitude of a vector?
Calculate the maximum number of possible mistakes made by the perceptron algorithm if the margin of the separator is 4 and the maximum magnitude of a point is 8.	When a line of separation is +4 and the maximum magnitude of the point is +8, calculate the maximum number of possible mistakes made by the perceptron algorithm.	Calculate the maximum number of possible errors made by the perceptron algorithm if the margin of the separator is 4 and the maximum magnitude of a point is 8.	Calculate the maximum number of possible mistakes by the perceptron algorithm if the margin of the separator is 4 and the maximum magnitude of a point is 8.	In this example, Calculate the maximum number of possible mistakes made by the perceptron algorithm if the margin of the separator is 4 and the maximum magnitude of a point is 8.
Consider the classifiers [ 1 3 0 ] and [ 2 3 1 ]. Do they represent the same classifier? Return 1 if true and another value if false.	Consider the [ 1 3 0 ] and [ 2 3 1 ]. Do they represent the same classifier = 1000 or 1? Return 1 if true and another value if false.	1 3 0  2 3 1  2/3 1  assign, are they similar to one another? Are they different classes?	If the classifier [ 1 3 0 ] and [ 2 3 1 ] are similar, they are the same classifier : return 1 if true and another if false.	Is 1 3 0 and 2 3 1 same classifier?
A classifier has a decision boundary where theta is ( 1 3 ). What value does it classify p, where p is ( (0 negative 1 )?	From a classifier a decision boundary where theta is 1 3. What value does it classify p,where p is ( 0 negative 1 )?	A classifier has a decision boundary where theta is (1 for every count). What value does it classify p, where p is (0negative10 )?	A classifier has a decision boundary where theta is ( (1 3 ). What value does it classify p, where p is (0 negative 1 )?	A Classifier has a decision boundary where theta is( 1 3 ). What value does it classify p, where p is ( 0 negative 1 )?
What are the most number of mistakes made by the perceptron algorithm if 16 is the maximum magnitude of a point in the dataset and the dataset has a margin of 5 to the separator?	What is the most point in a dataset that the size of the element is increased with the perceptron from 17 to 25 if the mean of the increment is 16?	What is the most number of mistakes made by the perceptron algorithm if 16 is the maximum magnitude of a point in the dataset and the dataset has a margin of 5 to the separator?	What is the most number of errors made in Perceptron algorithm when 16 is the maximum magnitude of a point in the dataset and the dataset has a margin of 5 to the separator?	What is the most number of mistakes made by the perceptron algorithm if 26 is the maximum magnitude of a point in the dataset and the dataset has a margin of 10 to the separator.
Return 0 for the following two classesifiers, and check whether they correspond to the same hyperplane, if you are stitched (for each) and id (both with zero helix). This method is useful if two classesifiers are required in a classifier function. The following two classifiers are possible, i.e. : [ 1 1 1 ] & [ 1 2 1 ]. If yes, return 1 and return anything else otherwise	If one of the following two example classifiers is a hyperplane, return 1, and remove anything else otherwise. Determine if the following two classifiers represent the same hyperplane. If so, return 1.	Determine if the following two classifiers represent the same hyperplane, [ 1 1 1 ] and [ 1 2 1 ]. If so, return 1, and return anything else otherwise.	Determine whether the following two classifiers represent the same hyperplane, [ 1 1 1 ] and [ 1 2 1 ]. If so, return 1, and return anything else else otherwise.	When two classifiers exist on the same hyperplane, [ 1 1 1 ] and [ 1 2 1 ], return 1. If so, return anything other... determines that the following two classifiers represent the same hyperplane.
Given the classifiers [ 1 3 1 ] and [ 1 4 0 ] determine if they are the same classifier. Return 1 if So... and anything else if Not.	Is [ 1 3 1] equal to [ 1 4 0], or more specifically the same classifier?	Given the classifiers [ 1 3 1 ] and [ 1 4 0 ], determine if they are the same classifier. Return '1' if so and anything else if not [ 1 3 1 ].	Given the classifiers — 1 3 1 _and — 1 4 0 _, determine if they are related or different? Return 1 if so and anything else if not.	Given the classifiers [ 1 3 1 ] and [ 1 4 0 ], determine if they are the same classifier. Return 1 if so and anything else if not.
A point p is classified by a classifier whose decision boundary is theta = ( 2 3 ). How does it classify p, where p is ( 3 0 )?	A point in p is classified by a classifier whose decision boundary is theta = (2 3 ). Whether or not be p is (3 0 ), or 2 0?	Suppression for the argument p is used in physics and engineering and the difference is then given Theta = ( 2 3 ). Now how does p classify?	How does the decision boundary of theta classify p?	How does a classifier classify p, where 3=0?
If the decision boundary of a classifier is theta, where theta is equal to ( 2 3 ) how does it classify point p, where p is equal to ( 3 negative 2 )?	If the decision boundary of a classifier is theta, where theta is equal to ( 2 3 ), how does it classify point p, where p is equal to ( 3 negative 2 )?	If the decision boundary of a classifier is theta, where theta is equal to ( 2 3 ), how does it classify point p, where p is equal to ( 3 negative 2)?	If the decision boundary of a classifier is theta is equal to ( 2 3 ), how does it classify point p, where p is equal to ( 3 negative 2 )?	If the decision boundary of classifier is theta, where theta is equal to 3-4, how does it classify point p? And whether p is equal to three negative 2?
If the margin of the dataset with respect to a separator is 5. and the maximum magnitude of a point is 16, what is the worst-case theoretical bound for the number of mistakes the perceptron algorithm would make?	If the margin of a dataset with respect to a separator is 5 and the maximum magnitude of a point is 16, what is the worst-case theoretical bound for the number of errors the perceptron algorithm would make?	If the margin of the dataset with respect to a separator is 5 and the maximum magnitude of a point is 16, what is the worst-case theoretical limit for the number of mistakes the perceptron algorithm would make?	What is the worst-case theoretical bound for the number of mistakes the perceptron algorithm could make?	If the margin of the dataset with respect to the separator is 5 and the maximum magnitude of a point is 16, what is the worst-case theoretical bound for the number of mistakes the perceptron algorithm would make?
When some classes start calling [ 3 1 1 ] & "0 1 1 0" do they represent the same hyperplane? Return 1 if true and another value if false.	Do the classifier [3 1 1] and the constructor [0 1 0] both represent the same hyperplane? Return 1 if true and another value if false.	Take the classifier 2 [ 3 1 1 ] and [ 0 1 0 ]. Do they both represent the same hyperplane? Return 1 if true and another value if false	Take the classifier [ 3 1 1 ] and [ 0 1 0 ]. Do they represent the same hyperplane? Return 1 if true and another value if false.	If classifiers [ 3 1 1 ] and [ 0 1 0 ] have the same hyperplane, will they return 1 if true?
If given the values for theta as 2 and theta_0 as 1, compute the NLL loss on the data point 2 2. Use log base e of 2.71828 for log.	Given the values for theta as 2 and theta_0 as 1, compute the NLL loss on the data point ( 2 2). Use log base e of 2.71828 for the log.	What is the NLL loss on 2/2 from theta_0 on the data point 2.71828?	Given the values for theta as 2 and theta_0 as 1, compute the NLL loss on the data point on the Data point, use log base e of 2.71828 for the log.	Gibeted the values of theta as 2 and theta_0 as 1, compute the LBS loss for the measurement on the datapoint (2 2 ) by using log base e of 2.53828 for the Log log() function.
What is the result of adding negative2 to sigmoid? Let e be connected 2.71828.	What is the result of applying the value negative 2 to the sigmoid function? Let e be equal to 2.71828?	What is the result of applying t negative 2 to the sigmoid function? Let e be equal to 2.91828?	What are the results of applying negative 2 to the sigmoid function? Let e be equal to 2.71828.	What is the result of applying the value negative 2 to the sigmoid function? Let e be the same as 2.71828.
What is the size of the margin of 9 point 1 by a classifier with theta 1.	What is the size of the margin of a point 1 in the classifier without theta positive 1 or theta_0 negative 2 if the point has label negative 1?	What is size of the margin of a point 1 by a classifier with theta 1 and theta_0 negative 2 if the point has label negative 1?	What is the size of the margin of a point by a classifier with theta -1 and theta_0 negative 2 if the point has label negative 1?	What is the size of the margin of a point 1 by a classifier with theta 1 and theta_0 negative 2 if the point has label negative 1?
Assume e is equal to 2.71828. What do you get from passing the value 8 into the sigmoid function?	Assume e is equal to or larger than 2.71828 and what from passing the value 8 into the sigmoid function?	Assume e is equal to 2.71728. What do you get from passing an integer 8 in the sigmoid function?	I mean e assume l is equal to 2.71827. What can 1 achieve if I pass the value from 8 into the sigmoid function?	Assume there is a value of e equal to 2.71828. What would happen if you passed the result 8 into the sigmoid function?
What is the loss for the data point 0 1 if we use NLL. Let theta be 2 and theta_0 be 3. Also use natural log where the base is 2.71828.	What is the loss for the data point ( 0 1 ) if we use NLL. Let theta be 2 and theta_0 be 3. Also use natural log where the base is 2.71828.	What is the loss of the data point ( 0 1 ) if we use NLL. Let theta be 2 and theta_0 be 3. Also use natural log where the base is 2.71828	What is the loss for the data point ( 0 1 ) if we use NLL? Let theta be 2 and theta_0 be 3. Also use natural log where the base is 2.71828.	What is the loss for the data point (0 1 ) if we use NLL. Let theta be 2 and theta_0 be 3. Also use natural log where the base is 2.71828.
What is the NLL loss for the single data point ( 2 0 ) where theta is 2 and theta_0 is 2? Let the log be natural log ( base is 2.71828) to avoid the real non existent data.	What is the NLL loss for the single data point ( 2 0 ) where theta is 2 and theta_0 is 2? Let the log be natural log (base is 2.71828 ).	Will there be an NLL loss for 2 0 where theta is 2 and theta_0 is 2?	What is the NLL loss for the single data point ( 2 0 ) where theta is 2 and theta_0 is 2? Let the log be natural log ( base is 2.71828 ) as by default, if NLL loss is zero and which data is allocated as a series.	What is the NLL loss () by 2 0 in the single data point where theta is 2 and theta_0 is 2? Let the log be natural log ( base is 2.71828 ).
How would the margin on the point 2 with a label negative, be calculated if is classified in the classifier program if theta 1 and theta_0 are not recorded?	What is the margin on a point 2 with a label negative 1 if it is classified by a classifier with theta 1 and theta_0 negative 1?	What is a margin on point 2 with a label negative 1 if it is classified by a classifier with theta 1 and theta_0 negative 1?	What is the margin on a point 2 with a label negative 1 if it is classified by a classifier with theta 1 and theta 0 negative 1?	What is the margin on a point 2 with labels negative 1 if it is classified by a classifier with theta 1 and theta_0 negative 1?
What does the sigmoid function return when you pass into it 24? Hint: have e be 2.71828.	What does the sigmoid function return when you pass into it 24? Hint: have e be 2.71828	What does sigmoid return when you pass through it 24? Hint: have e12.71828.	What does the sigmoid function return when you pass into it 24? Hint: Have e be 2.71828.	What output does the sigmoid function return when you pass into it 24? Hint: have e be 2.71828.
Compute the loss from the datapoint ( 2 1 ) using an NLL and natural log, where the base is 2.71828. Have theta be 2 and theta_0 be 1	If the loss from the datapoint ( 2 1) is 2.71828 then take the loss as the base and calculate the loss to the second or the last step. have theta be 2 and ta_0 be 1.	Compute the loss from the datapoint ( 2 1 ) using NLL and natural log, where the base is 2.71828.have theta be 2 and theta_0 be 1. Theta or 0.. theta_0 =1 only. If., then " theta [1 ] (i.e. 0 are *:1), is it 1.3?	Compute the loss from the datapoint ( 2 1 ) using NLL and natural log, where the base is 2.71828. Have theta be 2 and theta_0 be 1... Calculate the loss from two 2 1 = 1 ( 1 1) ( graph  1  2.0  1.28).	Compute the loss from the datapoint ( 2 1) using NLL and natural log, where the base is 2.71828. If theta is 2 and theta_0 is 1, then '#/0' will be the point of the datapoint 2 1 ( 3, 5, 7). ( ( 6)
Consider the point ( 0 2), the theta 2 and the theta_0 3 as NLL loss. What is the NLL loss?	What is the loss of NLL?	Mynore: Consider the point ( 0 2 ), the theta 2 and the theta_0 3. What is the NLL loss of..using log, where the base is 2.71828. So I don't expect any changes of the log.. Use log.	What is NLL loss (negative if 0 = 2), with the theta, 2 & 3?	Calculate the NLL loss of point 0 2, theta 0 and theta 0 3 respectively.
Calculate the value of the function at 1 after changing the eta value in gradient descent. Have theta be 4 and eta be 0.01. (* 2  theta + negative 2  4  4  theta 5)	Calculate the value of the function (2 * theta + negative 2 ) 4 after updating the theta value in one step of gradient descent. Have theta be 4 and eta be 0.01.	Calculate the value of the function ( 2 * theta + negative two ) of 4 after updating the theta value in one step of gradient descent. Have theta be 4 and eta be 0.01.	If theta is 4. The function name is not the function after gradient descent. We calculate the value of the function from 2  2 + negative 2. If 4 doesn't exist, calculate the function from 2 to 4. Have theta and eta be 0.01.	Calculate the value of the function 4, and theta (negative 2 in 1 step of gradient descent). Have theta be 5 & eta be 0.
Let theta be ( negative 2 1 ), theta_0 be 0.25, and x be ( 0, negative 1 ). Compute theta times x plus theta_0. (a..... = +).	Let theta be (negative 2 1 ), theta_0 be 0.25, and x be ( 0, negative 1 ). Compute theta times x plus theta_0.	Let theta be ( negative 2 1 ),theta_0 be 0.25, and x be ( 0, negative 1 ). Compute theta times x plus theta_0.	Let theta be ( negative 2 1 ), theta be 0.25, and x be ( 0, negative 1 ). Compute theta times x + theta_0.	Let theta be ( positive 2 1 ), theta_0 be 0.25, x be ( 0, negative 1 ). Compute theta times x plus theta_0.
Calculate the updated theta after one gradient descent step if theta is 3, eta is 0.05, and the loss function is ( 1 * theta + 3 )  2.	Calculate the updated theta after one gradient descent step if theta is 3, eta is 0.05 and the loss function is 1 * theta + 3 )  2.	Calculate the updated theta after one gradient descent step if theta is 3 and eta is 0.05, and the loss function is ( * theta + 3 )  2.	Calculate the updated theta after the One gradient descent step if theta is 3, eta is 0.05, and the loss function is ( 1 * theta + 3 )2. If gradient demounting is not possible then the update results are not the changes in the one gradient step.	Calculate the updated theta after one gradient descent step if theta is 3, eta is 0.05, and the loss function is ( ( 1 * theta + 3 )  2.
The function ( 2 * theta + negative 1 ) is the loss function when performing a gradient descent. Calculate the loss after one step of gradient descent. Let theta be 2. and eta be 0.01.	The function ( 2 * theta + negative 1 ) is the loss function in performing a gradient descent. Calculate the loss after one step of gradient descent. Let theta be 2 and eta be 0.01	All variables of gradient descent are added along with the function (2 * theta + negative 1 ) in the order where the function is not added. Calculate the loss of this function. Let theta be 2 and Let eta be 0.01.	Assuming the negative integer is equal to 4 for a function, the function ( 2 * theta + negative 1 ) is the loss function. Set theta equal to 2 and eta equal to 0.01.	The function ( 2 * theta + negative 1 ) 4 is the loss function in performing a gradient descent. Calculate the loss after one step of gradient descent. Let theta be 2 and eta be 0.01.
If theta be 1 and eta be 0.09, what is the updated theta value after one gradient descent step if the loss function is given by ( negative 1 * theta + 3 )  2?	If you let theta be 2 and eta be 0,01, what is the updated theta value after one gradient descent step if the loss function is given by ( negative 1 * theta + 3 )  2?	What is the update of theta value after one gradient descent step if the loss function is given by (positive 1 * theta + 3 )  2 for zero values?	If you let theta be 2 and eta be 0.01,what is the updated theta value after one gradient descent step if loss function is given by ( negative 1 * theta + 3 )  2?	If you let theta be 2 and eta be 0.01, what is the update theta value after one gradient descent step if the loss function is given by (Negative 1 * theta + 3 ) - 2?
Let A Function = f(theta) = n(0 *theta + 3 )  4. For theta = 1.9 and eta = 0.05, calculate theta after one gradient descent step.	Let a function f(theta) =( 0 * theta + 3 )  4, for theta =3, and eta = 0.05, calculate theta after one gradient descent step.	Let a function f(theta) = ( (0 * theta + 3 )  4. For theta = 3 and eta = 0.05, calculate theta after one gradient descent step.. (logically)	Let a function f(theta) = (0 * theta + 3 )  4. If theta = 3 and eta = 0.05, calculate theta after one gradient descent step?	Let a function f(theta) = (0 * theta + 3 ) [math]  4 [math] for theta = 3 and eta = 0.05] calculate theta after one gradient descent step[math]
Let a function f(theta) = ( 2 * theta + negative 1 )  3. For theta = 1 and eta = 0.05, calculate f(theta) after one gradient descent update.	Let a function f(theta) = ( 2 * theta + negative 1 )  3. For theta = 1 and eta = 0.05, calculate f(theta) after gradient descent update for 1st update.	Let a function f(theta) = ( 2 * theta + negative 1 )  3. For theta = 1 and eta = 0.5, calculate f(theta) after one gradient descent update.	Let a function f(theta) = 2 * theta + negative 1 ) 3. For theta = 1 and eta = 0.05, calculate f(theta) after gradient descent update.	Let a function f(theta) = ( 2 * theta + negative 1 ) 3. For theta = 1 eta = 0.05, calculate f(theta) after a gradient descent update.
What is the result of theta times x plus theta_0 if x is ( 1 negative 1 ), Theta is ( 1 negative 1 ), and theta_0 is 6?	What is the result of theta times x plus theta_0 if y is ( 1 negative 1 ), theta is ( 1 negative 1 ) and theta_0 is 6?	What is the result of theta times x plus theta_0 if x is ( 1 negative 1 ), theta is ( 1 negative 1 ) and theta_0 is 6?	What is the result of theta times x plus theta_0 even if x is 1 negative 1, theta is 1 negative 1, and theta_0 is 6?	What is not a % value with theta times x plus theta_0 if x is ((1) 1 negative 1 ), theta is ((1) negative 1 ) and theta_0 is 6?
Given a function ( 2 * theta + 0 )  3, calculate the value of the function after one gradient descent update. if theta is 0 and eta is 0.05.	Given a function (2 * theta + 0 ) 3, calculate the value of the function after one gradient descent update if theta is 0 and eta is 0.05.	Given function 2 * theta + 0 )  3, calculate the value of function after one gradient descent update if theta is 0 and eta is 0.05.	Given a function ( 2 * theta + 0 )  3, calculate the value of the function after one gradient descent update if theta is 0 and eta is 0.05.	Given a function ( 2 * theta + 0 ) 3, calculate the value of the function after one gradient descent update if theta is 0 and eta is 0.05
Given a function ( 0 * []theta +]3||[|] en>1 en], an output transform’s theta after one gradient landing step if theta is 2 and eta is 0.01 and the answer is pronounced without any other.	Given 0 * theta + 3, compute theta after one gradient descent step if theta is 2 and eta is 0.01.	Given a function ( 0 * theta + 3 ) 3, compute theta after one gradient descent step if theta is two and eta is 0.01.	Given a function ( 0 * theta + 3 )  3, compute theta after one gradient descent step if theta is 2 and eta is 0.01	Given a function ( 0 * theta + 3 )  3, compute theta after one gradient descent step if theta is 2 and eta is 0.01 ; assume the values of ‘0’ and “’1’.
Calculating the value of y in the dataset [ ( 0 0 ), ( 1 2 ), ( 2 y ) ] if we know that the optimal theta 2 used mean squared error (mse) Let lambda be 1.	If we know that the optimal theta 2 used mean squared error, let lambda be 1, and the results are given as 2 x2. Calculate y in dataset [ ( 0 0 ), 1 2 ), ( 2 y ) ] with functions b ( [(] [ [][[162 X10]] as. A ].	Calculate the value of y in the dataset [ ( 0 0 ), ( 1 2 ), ( 2 y ) ] if we know that the optimal theta 2 used mean squared error. Let lambda be 1.	Calculate the value of y in the dataset [ ( 0 0 ), ( 1 2 ), ( 2 y ) ] if we know the optimal theta 2 used mean squared error. Let lambda be 1.	Calculate the value of y in the dataset [ ( 0 0 )|1.2 =2.y] if we know that the optimal theta 2 used the mean squared error. Let lambda be 1?
If f(theta) is 9 times theta plus 8 squared, then what is f(theta) if theta is 1?	If theta is 9 times theta plus 8 squared, what is f(theta) if theta is 1?	If f(theta) is 9xtheta plus 8 squared why is it f(theta) when theta is 1?	When theta is 1 can you prove the ratio of 9 times theta + 8 with the different values?	If theta is 9 times theta plus 8 squared, what is f(theta) when theta is 1?
When it comes to maths, f(theta) is the square of the sum of 8 and the product of 5 and theta, where theta is 3?	f(theta) is the square of the sum of 8 and the product of 5 and theta, where theta is 1. What is the meaning of f(theta)?	F(theta) is the square of the sum of 8 and the product of 5 and theta, where theta is 1. What is f(theta)?	What is f(theta)?	f(theta) is the square of the sum of 8 and a product of 5 & theta, where theta is 1. What is this result?
Compute the mean squared error with the data points [ ( 2 negative 1 ) and [ ( 2 4 ) ], theta = 0, and lda = 1. What are the arguments for this?	Stumpf: calculate mean squared error. To determine the mean squared error, add 2 negative 1 dpi and 2 4 dpi. Theta = 0 dpi but you are trying to do 3 positive coefficients in reverse. The mean squared error is 1 (regress coefficient).	Compute the mean squared error with the data points [ ( 2 negative 1 ) and [ 2 4 )], theta = 0 and lda = 1.	Calculate the mean squared error with data points [ ( 2 negative 1 ) and ( 2 4 ) ], theta = 0 and lda = 1.	Calculate the mean squared error for the mean squared error of the largest vector by the average vector.
