A ReLU is applied to the output of neuron C, which takes in outputs from neurons A with weight wAC = 1 and B with weight wBC = 2 and offset oC = 3. Neuron A takes in value x1 = negative 1 with weight w1 = 2 and offset value oA = 0.5. Neuron B takes in input x2 = 0 with offset of 1.	A ReLU is applied to the output of neuron C, which takes in outputs from neurons A with weight weight wAC = 1 and B with weight wBC = 2 and offset oC = 3. Neuron A takes in value x1 = negative 1 with weight w1 = 2 and offset value oA = 0.5. Neuron B takes in input x2 = 0 with offset of 1.	A ReLU is applied to the output of neurons A and B. The neuron takes in outputs from the neurons A with weight wAC = 1 and BC = 2 and offset oC = 3. Neuron A takes in value x1 = negative 1 with weight w1 = 2 and offset value oA = 0.5. Neuron B takes in input x2 = 0 with offset of 1. The output of the neurons H has no value at all.	A ReLU is applied to the output of neuron C, which takes in outputs from neurons A with weight wAC = 1 and B with weight wBC = 2 and offset oC = 3. Neuron A takes in value x1 = negative 1 with weight w1 = 2 and offset value oA = 0.5. Neuron B takes in input x2 = 0 with an offset of 1. Sleight of hand: -	A ReLU is applied to the output of neuron C which takes in outputs from neurones A with weight wAC = 1 and B with weight wBC = 2 and offset oC = 3. Neuron A takes in value x1 = negative 1 with weight w1 = 2 and offset value oA = 0.5. Neuron B takes in input x2 = 0 with an offset of 1.
Neuron C is the output neuron of the same neural network and applies a ReLU function on its output. Neuron A takes in value x1 is negative 1 with weight y1 being 1 and offset value oA being 0.5 with weight wOA being 3. Neuron C take in the output of neuron A with weight wAC being 1 and offset value oC being 1 with weight yOC being 2. What is the output?	Neuron A is the input neuron of a neural network. Neuron C is the output neuron of the same neural network and applies a ReLU function on its output. Neuron A takes in value x1 is negative 1 with weight w1 being 1 and offset value oA being 0.5 with weight wOA being 3. Neuron C takes in the output of neuron A with weight wAC being 1 and offset value oC being 1 with weight wOC being 2. What	Neuron A is the input neuron of a neural network. Neuron C is the output neuron of the same neural network and applies a ReLU function on its output. Neuron A takes in value of positive 1 with weight w1 being 1 and offset value oA being 0.5 with weight wOA being 3. Neuron C takes in the output of neuron A with weight wAC being 1 and offset value oC being 1 with weight wOC being 2. What is the output	Neuron A is the input neuron of a neural network. Neuron C is the output neuron of the same neural network. Neuron A takes in value x1 is negative 1 with weight w1 being 1 and offset value oA being 0.5 with weight wOA being 3. Neuron C takes in the output of neuron A with weight wAC being 1 and offset value oC being 1 with weight wOC being 2. What is the output?	Neuron C is the output of same neural network with two functions and weigh h1 is 1. Neuron A takes in value 1 is negative1 with offset value oA being 0.5 with weight wOA being 3. Neuron A takes in the output of neuron A with weight wAC being 1 and offset value oC being 1 with weight wOC being 2. What is the output?
Determine how many pixels of padding we need on the input of size 80 by 80 to ensure our filter 31 by 31 gives an output of the same size.	Calculate how many pixels of padding we need on the input of size 80 by 80 to ensure our filter 31 by 31 gives an output of the same size?	Determine how many pixels of padding we need on the input of size 80 by 80 to ensure our filter 31 by 31 leaves an output of the same size and width as before.	How many pixels of padding we need on the input of size 80 by 80 to ensure our filter 31 by 31 gives an output of the same size. Determine how many pixels of padding we need on the input of size 80 by 80 to ensure our filter 31 by 31 giving an output of the same size.	Determine how many pixels of padding we need on the input of size 80 by 80 to ensure our filter 31 by 31 gives an input of the same size.
What happens if I apply filters to the picture rows after applying ReLU activation on filter’s output?	What is the outcome from applying a filter to the image row after applying deactivated ReLU to filter’s output?	Is the result of applying filters to the image row after applying ReLU activation on filter’s output?	Is it possible for the user to apply an image filter for the image row after the application of ReLU activation on filter’s output?	How do I apply the filter on a photograph row after using ReLU activation to filter?
If both sides of an image are size 90 by 90 and it is filtered by 19 by 19, how far out should we pad so that both sides have the same output dimensions?	Can I pad an image of size 90 by 90 with a filter of size 19 by 19? How far out on each side should I pad to maintain the same output dimensions?	If we have an image of size 90 by 90 and a filter of size 19 by 19, how far out do we pad to maintain the same output dimensions?	If we have an image of size 90 by 90 and a filter of size 19 by 19, how far out on each side should we pad to maintain the same output dimensions?	If we have an image of size 90 by 90 and a filter of size 19 by 19 then how long do we pad on each side to maintain the same output dimensions?
If an image has a stride length of 1, what is the output from applying a filter of length 5 to an image of length 51?	What is the output from applying a filter of length 5 to an image of length 51?	What is output from applying a filter of length 5 to an image of length 51?	From a stride length of 1 what is the output of applying a filter of length 5 to an image of length 51?	Using a stride length of 1, what is the output from applying a filter of length 5 to an image of length 51?
Consider a filter [ 1 0 0] applied on an image [ 3 3 1]. What is the output if the filter has a ReLU activation?	Assume a filter [ 1 0 0 ] applied on an image[ 3 3 1 ]. What is the output if the filter has a ReLU activation?	Consider a filter [ 1 0 0 ] applied on an image [ 3 3 1 ]. What is the output if the filter has a ReLU activation?	What will happen if the filter has a ReLU activation?	What results can you obtain with a filter [1 0 0 ] applied on an image [3 3 1 ]?
Consider an image I of length 53 and filter F of length 17. What is the length of the output if we have a stride length of 2?	Consider an image I of length 53 as well as filter F of length 17. What is the length of the output if we have a stride length of 2?	What is the length of the output from image I for three consecutive seconds, when filter F is at least 17 %? If we have a stride length of 2 %, does this mean that the output is in a sequence of eight images?	A vector image of length 53 and a filter F of length 17. What is the length of the output of the vector image if we have a stride length of 2?	What is the length of the input table if we have a stride length of 2?
Using the row of an image and a filter [ 1 3 1], calculate the value of applying filter on top of the image.	Using the row of an image [ 1 3 1 ] and a filter [ 2 4 0 ], calculate the value of applying a filter on top of the image.	Using the row of an image [1 3 1 ] and a filter [2 4 0 ], calculate the value of applying filter on top of the image.	Using the row [ 1 3 1 ] and a filter [ 2 4 0 ], calculate the value of applying the filter on top of the image.	Using the row of an image [ 1 3 1 ] and a filter [ 2 4 0 ], calculate the value of applying the filter on top of the image.
What is the minimal number of padding needed to maintain the same output size if the output image is 60 by 60 and the filter is 19 by 19?	What is the minimum padding needed to maintain the same output size if the input image is 90 by 90 and the filter is 19 by 19?	What is the minimum number of padding needed to maintain the same output size if the input image is 90 by 90 and the filter is 19 by 19?	What is the minimum number of padding needed to maintain the same output size if the input image is 90 by 90 and the filter is 19 by 19.	What’s the minimum number of padding needed to maintain the same output size if input image is 90 by 90 and filter is 19 by 19?
What is the result from applying a filter to an image row?	I have an image row [ 1 2 1 ] and a filter [ 1 0 1 ] What is the result of applying the filter to the image row such that they both align?	What is the result of applying filter on the image row such that they both align?	What is the result from applying the filter to the image row such that they both align?	If the filter belongs to an image row, what will happen if he performs the same filter across multiple lines of view?
Now consider a zero-padded max pooling layer with 14 inputs, a pooling filter size of 5 and stride of 1. How many total output units are there for this layer?	Now consider a zero padded max pooling layer with 14 inputs, a pooling filter size of 5 and stride of 1. How many total output units are there for this layer?	Now consider a zero-padded max pooling layer with 14, a pooling filter size of 5 and stride of 1. How many total output units are there for this layer?	Now consider a zero-padded max pooling layer with 14 inputs... how many total output units are there?	Now consider a zero padded max pooling layer with 14 inputs, a pooling filter size of 5 and stride of 1. How many total output units are there in this layer?
Eq. consider the input x_t = [ 3 4 4 10 16 ] to a state machine with equations s_t = f(s_(t-1), x_t) AND y_t = g(s_t). Compute y_5 with initial conditions s_0 is 7, f(s_(t-1), x_t) = max (s_(t-1), x_t ), and g(	Consider the input x_t = [ 3 4 4 10 16 ] to a state machine with equation s_t = f(s_(t-1), x_t) and y_t = g(s_t). Compute y_5 if our initial conditions are s_0 is 7, f(s_(t-1), x_t) = max ( s_(t-1), x_t ) and g(	Consider the input x_t = [ 3 4 4 10 16 ] to a state machine with equation s_t = f(s_(t-1), x_t) and y_t = g(s_t). Compute y_5 if our initial conditions are s_0 is 7, f(s_(t-1), x_t) = max ( s_(t-1), x_t ), and	Consider the input x_t = [ 3 4 4 10 16 ] to a state machine with equations s_t = f(s_(t-1), x_t) and y_t = g(s_t). Compute y_5 if our initial conditions are s_0 is 7, f(s_(t-1), x_t) = max (s_(t-1), x_t ), and g(	Consider the input x_t = [ 3 4 4 10 16 ] as a State Machine with equations s_t = f(s) (t-1), x_t) and y_t = g(s_t). Compute y_5 if our initial conditions are s_0 is 7, f(s_(t-1), x_t) = max ( s_(t-1), x_t ) and g
If we have s_t = f(s_(t-1), x_t) and y_t = g(s_t), where x_t is the input, what is the output y_5 if we have s_0 being 11, f(s_(t-1), x_t) = max ( s_(t-1), x_t ), g(s_t) = 2, and	If we have a state machine, defined as s_t = f(s_(t-1), x_t) and y_t = g(s_t), where x_t is the input, what is the output y_5 if we have s_0 being 11, f(s_(t-1), x_t) = max ( s_(t-1), x_t ), g(s	If we have a state machine defined as s_t = f(s_(t-1), x_t) and y_t = g(s_t), where x_t is the input, what is the output of y_5 if we have s_0 being 11, f(s_(t-1), x_t) = max ( s_(t-1), x_t ), g(s_	If we have a state machine, defined as s_t = f(s_(t-1), x_t) and y_t = g(s_t), where x_t is the input, what is the output y_5 if we have s_0 being 11, f(s_(t-1), x_t) = max ( s_(t-1, x_t ), g(s_t	If we have a state machine, defined as 4 12 5 316 and we input, where x_t is the input, what is the output y_5 if we have s_0 being 11, f(s_(t-1), x_t) = max ( s_(t-1), x_t ) g(s_t) = 2 * s_t, and we output y_2?
What is the output y_5 of a state machine with equations s_t = f(s_(t-1), x_t) and y_t = g(s_t), condition s_0 = 8, f(s_(t-1), x_t) = max ( s_(t-1), x_t ), and g(s_t) = 2...?	What is the output y_5 of a state machine with equations s_t = f(s_(t-1), x_t) and y_t = g(s_t), conditions s_0 = 6, f(s_(t-1), x_t) = max ( s_(t-1), x_t ), and g(s_t) = 2 * s_t, and input x	How is the output y_5 of a state machine with equations s_t = f(s_(t-1, x_t) and y_t = g[s_t], condition s_0 = 3, f(s_(t-1, x_t) =x, s_(t-1, x_t ) & g(s_t) = 2s_t, and input x_t = [	What is the output y_5 of a state machine, as explained with equations s_t = f(s_(t-1), x_t) and y_t = g(s_t), conditions s_0 = 6, f(s_(t-1), x_t) = max (s_(t-1, x_t ), and g(s_t) = 2 * s_t and input x	What is the output y_5 of a state machine with equations s_t = f(s_(t-1), x_t) and y_t = g(s_t), condition s_0 = 6, f(s_(t-1), x_t) = max (s_(t-1), x_t ), and g(s_t) = 2 * s_t, and input x_
Let a state machine be described with the equations s_t = f(s_(t+1), x_t) and y_t = g(s_t), where x_t is the input. If s_0 is 5, f(s_(t-1), x_t) = max (s_(t-1) x_t ) and g(s_t) = 0 * s_t, what is the output	Let a state machine be described with the equations s_t = f(s_(t-1), x_t) and y_t = g(s_t), where x_t is the input. If s_0 is 5, f(s_(t-1), x_t) = max (s_(t-1), x_t ), and g(s_t) = 0 - s_t,	Let a state machine be described with the equations y_t = g(s_t) and f(s_(t-1), x_t) where x_t is the input. If s0 is 5 then, f(s_(t-1), x_t) = max( s_(t-1), x_t ), and g(s_t) = 0* s_t, what is the output	Let a state machine be described by the equations s_t = f(s_(t-1), x_t) and y_t = g(s_t), where x_t is the input. If s_0 is 5, f(s_(t-1), x_t) = max ( s_(t-1), x_t ), and g(s_t) = 0 * s_t, what is	Let a state machine be described with the equations s_t = f(s_(t-1), x_t) and y_t = g(s_t), where x_t is the input. If s_0 is 5 and f(s_(t-1), x_t) = max (s_(t-1), x_t ) and g(s_t) = 0, what is the output y_3 after
A state machine is defined by the equations s_t = f(s_(t-1), x_t) and y_t = g(s_t). Given the conditions s_0 = 9, f(s_(t-1), x_t) = max ( s_(t-1), x_t ), and g(s_t) = 1 * s_t, compute y_4 if the input is	A state machine is defined by the equation s_t = f(s_(t-1), x_t) and y_t = g(s_t). Given the conditions s_0 = 9, f(s_(t-1), x_t) = max ( s_(t-1), x_t ) and g(s_t) = 1r * s_t, compute y_4 if the input is	A state machine is defined by the equations X and Y. Given of the conditions s = 9, x and y, go to x and y, compute y_4 if the input is x and 3.13 and the output is debbed by 213 and i-t.	A state machine is identified by the equation s_t = f(s_(t-1), x_t) and y_t = g(s_t). Given the conditions s_0 = 9, f(s(t-1), x_t) = max ( s-(t-1, x_t ), and g(s_t) = 1 * s_t, compute y_4 if the input is [3	A power state machine is defined by the equations y_t = f(s_(t-1), x_t) and y_t = g(s_t). Given the conditions s_0 = 9, f(s_(t-1), x_t) = max (s_(t-1), x_t ), g(s_t) = 1* s_t, compute y_4 if the input is
Consider the input x_t = [ 1 1 7 18 15 13 ] to a state machine with equations s_t = f(s_(t-1), x_t) and y_t = g(s_t). Compute y_6 if our initial conditions are s_0 is 11, f(s_(t-1), x_t) = max ( s_(t-1), x_t ), and	Considentially, consider the input x_t = [ 1 1 7 18 15 13 ] to a state machine with equations f(s_(t-1) (x_t), and y_t (g(s_t) (x_t). Compute y_6 if our initial conditions are s_0 is 11, f(s_(t-1), x_t); max ( s_(t-1), x_t	Consider input x_t = [ 1 1 7 18 15 13 ] to a state machine with equations s_t = F(s_(t-1), x_t) and y_t = g(s_t). Compute y_6 if our initial conditions are s_0 is 11, f(s_(t-1), x_t) = max (s_(t-1), x_t ), and g	Compute y_6 if our initial conditions are s-0 is 11, f(s_(t-1), x_t) = max (s_(t-1), x_t ), and g(s_t) = 4 * s_t at a state-matine (e.g.1 0/1 lb) or 1 0 lb (cms) (fcc 1). Consider the input x_t = 1	Consider the input x_t = [ 1 1 7 18 15 13 ] to a state machine with equations s_t = f(s_(t-1), x_t) and y_t = g(s_t). Compute y_6 if our initial conditions are s_0 is 11, f(s_(t-1, x_t) = max (s_(t-1), x_t ) and g
If we have a state machine, defined as c t = wc x_t is the input x_t, what is the output y_6?	If we have the state machine s_0 being 2, f(s_(t-1), x_t) = max, s_(t-1), x_t ), g(s_t) = 0 * s_t, and we input [ 8 0 16 3 7 7] what are y's outputs?	If we have a state machine, defined as s_t = f(s_(t-1), x_t) and y_t = g(s_t), where x_t is the input, what is the output y_6 if we have s_0 being 2, f(s_(t-1), x_t) = max ( s_(t-1), x_t ), g(s	If we have a State-Machine, defined as s_t = f(s_(t-1), x_t) and y_t = g(s_t), where x_t is the input and what is the output y_6 if we have s_0 being 2, f(s_(t-1), x_t) = max (s_(t-1), x_t ), g(	If we have a state machine for a model, defined as s_t = f(s_(t-1), x_t) and y_t =g(s_t), where x_t is the input, what is the output y_6 if we have s_0 being 2, f(s_(t-1), x_t) =max ( s_(t-1), x_t ), g
What is the output y_5 of a state machine with equations s_t = f(s_(t-1), x_t) and y_t = g(s_t), conditions s_0 = 15, f(s_(t-1), x_t) = max ( s_(t-1, x_t ) and g(s_t) = 4 * s_t, and input x_t =	What is the output y_5 of a state machine with equations s_t = f(s_(t-1), x_t) and y_t = g(s_t), conditions s_0 =15, f(s_(t-1), x_t) = max ( s_(t-1, x_t ) and g(s_t) = (4 * s_t ), and input x_t	What is the output y_5 of a state machine with equations s_t = f(s_(t-1), x_t) and y_t = g(s_t), conditions s_0 = 15, f(s_(t-1), x_t) = max (s_(t-1), x_t ), and g (s_t) = 4 * s_t, and input x_t =	What is the output y_5 of a state machine with equations s_t = f(s_(t-1), x_t) and y_t = g(s_t), conditions s_0 = 15, f(s_(t-1), x_t) = max ( s_(t-1), x_t ), and g(s_t) = 4 * s_t, and input	What is the output y_5 of a state machine with equations s_t = f(s_(t-1), x_t) and y_t = g(s_t), conditions s_0 = 15, f(s_(t-1), x_t) = max ( s_(t-1), x_t ) and g(s_t) = 4 *s_t, input x_t =
Let a state machine be described with the equations s_t = f(s_(t-1), x_t) and y_t = g(s_t), where x_t is the input. If s_0 is 3, f(s_(t-1), x_t) = max ( s_(t-1), x_t ), and g(s_t) = 2 * s_t, what is	Let a state machine be described with the equations s_t = f(s_(t-1)), x_t) and y_t = g(s_t), where x_t is the input.If s_0 is 3, f(s_(t-1), x_t) = max ( s_(t-1), x_t ), and g(s_t) = 2 * s_t,	Let a state machine be described with the equations s_t = f(s_(t-1), x_t) and y_t = g(s_t), where x_t is the input. If s_0 is 3, f(s_(t-1), x_t) = max ( s_(t-1), x_t )and g(s_t) = 2 * s_t, what is the	Let a state machine be described with the equations s_t = f(s), x_t) and y_t = g(s_t), where x_t is the input. If s_0 is 3, f(s), x_t) = max ( s, x, t), and g(s_t) = 2 * s_t, what is the output y_6?	Let a state machine be described with the equations s_t = f(s_(t-1), x_t) and y_t = g(s_t), where x_t is the input. If s_0 is 3, f(s_(t-1), x_t) = max (s_(t-1), x_t, g(s_t) = 2, s_t, get what is the
A state machine defined by the equations f(s_0), x(t-1), and y_t = g(s_t). Given the conditions s_0 = 15, f(s_(t-1), x(t) = max ( s_(t-1, x_t ), and g(s_t) = 4 *s_t, compute y_5 if the input is x_t = [18 6	If y_t = [ 18 6 12 15 12 ] + = (t+11, x1, x1, y= ()= (x1, x1, x2), then assume thats y_05 whichever is higher and subtracts the input is x_t = [ 18 6 12 15 12 ]. If [  .] is a state machine, then we assume that if it is s_0 =	An input values s_t = [18 6 12 15 12] and y_t = [48]. Given the conditions s_0 = 15, f(s_(t-1), x_t) = max ( s_(t-1, x_t ), and g(s_t) = 4 + s_t, compute y_5.	A state machine is defined by the equations s_t = f([15] x[15]) and y_t = g([15]]. Given the conditions s_0 = 15, f(s_[15], +]x[15]), and g[s_t] = 4|s_t], and g(s_t) = 4*s_t, compute y_5.	A state machine is defined by the equations s_t = f(s_(t-1), x_t) and y_t = g(s_t). Given the conditions s_0 = 15, f(s_(t-1), x_t) = max ( s_(t-1), x_t ) and g(s_t) = 4x s_t, compute y_5 if the input is x_t
After applying q learning to q =6, what is its value? Let the t be 8 and a be 0.2.	After applying Q learning to q = 6, what is its value? Let the t be 8 and a be 0.0.2.	After applied Q learning to q = 6 what is its value? Let the t value 8 and a be 0.2.	If q = 6 and y = 8 what is the value of t in its formula?	When Q learning is applied to q = 6, what is its value? Let the t be 8 and a be 0.2.
If q is 0 and the a is 0.2, and t is 2 what will be the update Q value of that tuple?	What is the adjusted Q value of a tuple ( s a ) if q is 0 per % and a 2 per %?	What is the updated Q value of a tuple ( s a ) if q is 0, the a is 0.2, and the t is 2?	What is the updated Q value of a tuple ( s a )? If Q is 0, the a is 0.2, and t is 2, what will exist for that value (as of Oct 2016)?	How Q is updated for s a tuple + 0?
If a is 0.2 and t is 4 what is the Q learning value after applying one tuple ( s a ) if q is 5?	If a is 0.2 and t is 4 what is the Q learning value after applying one tuple (S A) if q is 5?	If a is 0.2 and t is 4, what is the Q learning value using a singular tuple ( s a ) if q is 5?	If a is 0.22 and t is 4 what is the Q learning value after applying one tuple ( and s a ) if q is 5?	Answer: If t is 4 and a is 0.2, what is the learning value for qual function test if q is 5?
Let q = 2. After Q learning, what is q if a is 0.1 and t is 6?	Let q = 2. After Q learning what is q if a is 0.1 and t is 2?	Let q = 2 and after learning the next question was asked what is q if a is 0.1 and t is 2?	What would be q after learning Q and if the relative direction of t and a is 0.2 and the relative direction of a is 2?	What is q if a is 0.1 and t is 2?
If q is 0, what is its updated value after applying Q learning if a is 0.1 and t is 8?	If Q is 0 what is its updated value after applying Q learning if a is 0.1 and t is 8?	If q is 0 then what is its updated value after applying Q Learning if a is 0.1 and t is 8?	If Q is 0 what was its revised value after applying Q learning if a is 0.1 and t is 8?	Can you check the updated value of Q learning if a is 0.1 and total of t are 8?
After applying Q learning to q is 4, what is its value? Let the t be 8 with 0.1.	After applying Q learning to q = 4, what is its value? Let t be 8 & a be 0.1.	After applying Q learning to q = 4, what is its value? Let the t be 8 and d be 0.1.	If q = 4 and t = 8, where is the value of t?	After applying Q learning to q = 4, what is its value? Let t be 8 and a be 0.11.
What is the updated Q value of tuple(s a ) if q is 3, a is 0.2, and t is 6?	What is the updated Q value of a tuple (s a ) if q is 3, the a is 0.2, and t is 6?	What is the updated Q value of tuple (s a ) if q is 3, the a is 0.2, and t is 6?	What is the updated Q value of a tuple ( s a ) if q is 3, the a is 0.2, and t is 6?	What's the updated value of s a in tuple (q) if q is 3, the a is 0.25, and t is 6?
If t is 6 and a is 0.2 what is the Q learning value after applying one tuple ( s A ) and q is 2?	If a is 0.2 and t is 6, what is the A learning value after applying one tuple (s a) if q is 2?	If a is 0.2 and t is 6 what is the Q learning value after applying one tuple (s a ). if q is 2	If t is 6 and a is 0.2 what is the data then from one tuple (S A) what is the learning value?	Is it Q learning value after applying tuple (s a) if q is 2?
Let q = 0. After Q learning, what is q if a is 0.1 and t is 10?	Let q = 0 or, if a is 10 or 0.1 or t is, what is the solution?	Is q real? Tells us about the last Q learning?	Let q = 0. After Q learning what is q if a is 0.1 and t is 10?	If t is 10 and a is 0.1 what is q if q is 0 and a is 0 after q learning?
If q is 3 what is its updated value after applying Q learning if a is 0.2 and t is 4?	If q is 3, what is its updated value after applying Q learning if a is 0.2 and t is 4?	If it's 3, what is its update value after applying Q learning if a is 0.15 and t is 4?	If Q is 3, what is its updated value after applying Q learning if a is 0.25 and t is 4.11?	If q is 3, what is its updated value after applying Q learning if a is 0. and t is 4?
An RNN is defined as s_t = W*st-1 + x_t. If s_0 is 1, w is 0, and x is [ 0.25 0.5 ],what is s_2?	An RNN is defined as s_t = w * s_t-1 + x_t. When s_0 is 1, w is 0, and y is [ 0.25 0.5] then what is s_2?	What is s_2?	An RNN is defined as s_t =s_t-1,s_t-1 +x_t. If s_0 is 1 is 0 and what should be x,when is s_2?	An RNN is defined as s_t = (w * * s_t-1) + x_t. If s_0 is 1 then w is 0, and x is [ 0.25 0.5], what are s_2?
What is the RNN result s_1, where s_0 is 3 and w is 1? [0 3 1 ]	What is s_3 if s_0 is 3, w is 1, and x is [0 3-1 ] if we let s_t = w * s_t-1 + x_t?	What is the RNN result s_3 if s_0 is 3, w is 1 and x is [ 0 3 1 ]. If we allow s_t = w* s_t-1 + x_t then what is correct answer?	What is the RNN result s_3 if s_0 is 3, w is 1, and x is [ 0 3 1 ] if we let s_t = w * s_t-1 + x_t?	What is the RNN result s_3 if s_0 is 3, w is 1, and x is [0 3 1 ] if we let s_t = w * s_t-1 + x_t?
Consider a very simple RNN, defined by the following equation: s_t = w * s_ t-1 + x_t. Given s_0 = 1, w = 0.1, and x = [0 3 1 ], what is s_3?	Consider a very simple RNN by the following equation: w * s_ t-1 + x_t. Given s_0 = 1, w =0.1, x = [ 0 3 1 ] what is s_3?	How is s_t determined by multiplying w== s_t-1 += == s_b -1 rnn_h? Given s_0 = 0 rn + 0 rn w=3 rn = s_0 rn x = [ 0 3 1 ] rn s_3?	Consider a very simple RNN, defined by the following equation: s_t = w * s_ t-1 + x_t. Given s_0 = 1, w = 0.1 and x = [ 0 3 1 ], what is s_3?	Consider a simple RNN the type = = () > (-1) + -> ()(). Given s(!/., =+   0,=1 and  =+W,+X( = 0 31 )/,===s(>). What is s( / + d2)?
What happens if s_0 is 1.5, w is 1.5, and x is [ 1 0 2 ]?	We define an RNN as s_t = w * s_t-1 + x_t. What is s_3 for s_0, if W is 1.5, and x is [ 1 0 2 ]?	If s_0 is 1.5, w is 1.5, and x is [ 1 0 2 ], what is s_3 if v is 1?	We define an RNN as s_t = w * s_t-1 + x_t. What is s_3 if s_0 is 1.5, w is 1.5, and x is [ 1 0 2 ]?	What does a RNN mean if it is is vehicle 2 = s_0 =  = 1.5 vs  = 2.5 vs  = 1 0 2 / == =  =? Or why not is x more = = 2?
Let s_0 be 1.5, w be 1, and x be [ 1 0 2 ]. Compute the table s_3. If s_t is w * s_t-1 + x_t, why?	Let s_0 be 1.5, w be 1, and x be [ 1 0 2 ]. Compute s_3 if s_t is w+s_t-1+x_t.	Let s_0 be 1.5, w be 1, and x be [ 1 0 2 ]. Compute s_3 if s_t is w * s_t-1 + x_t.	Lets s_0 be 1.5, w be 1 and x be [ 1 0 2, ]. Compute s_3 if s_t is w as x = s_t-1 + x_t.	Let s_0 be 1.5, w be 1, and x be [ 1 0 2 ]. Compute s_3 if s_______ is w + s_______1 + x_t 1-1-1.
