An RNN is defined as s_t = w * s_t-1 + x_t. If s_0 is 1.5, w is 0.1, and x is [ 0 3 1], what is s_3?	An RNN is defined as s_t = w * s_t-1 + x_t. If s_0 is 1.5, w is 0.1, and x is [ 0 3 1 ], what is s_3?	An RNN is defined as s_t = w * s_t-1 + x_t If s_0 is 1.5, w is 0.1, and x is [ 0 3 1 ] what is s_3?	An RNN is defined as s_t = w * s_t-1 + x_t. If s_0 is 1.5, w is 0.0, and x is [ 0 3 1 ], what is s_3?	What is s_t = w + s_t-1 + x_t?
What is RNN expression s_3 if s_0 is 3, w is 1 and x is [ 1 0 2 ] if we let s_t = w * s_t+1 + x_t?	What is the RNN result s_3 if s_0 is 3, w is 1, and x is [ 1 0 ] if we let s_t = w * s_t-1 + astom?	What is the RNN result s_3 if s_0 is 3, w is 1, and x is [ 1 0 2 ] if we let s_t = w * s_t-1 + x_t?	What is the RNN result s_three if s_0 is 3 w is 1, and x is [ 1 0 2 ] if we let s_t = w * s_t-1 + x_t, and is returned immediately?	What is the RNN result s_3 if s_0 is 3, w is 1, and x is [ P 0 2 ] if we let s_t = w * s_t-1 + x_t?
Consider a very simple RNN, defined by the following equation: s_t = w * s_ t-1 + x_t. Given s_0 = 2, w = 1, and x = [ 2 2 0], what is s_3?	Consider a very simple RNN, defined by the following equation: s_t = w = s_ t-1 + x_t. Given s_0 = 2, w = 1, and x = [ 2 2 0 ] what is s_3?	Consider a simple RNN which allows the following equation: s_t = w * s_ t-1 + x_t. Given s_0 = 2, w = 1, and x = [2 2 0 ], what is s_trix?	Consider a very simple, RNN: st = w + s_t-1 + x_t. If s_0 = 2, w = 1, x = [2 2 0 ],what is s_3?	Consider a very simple RNN, defined by the following equation: s_t = w * s_ t-1 + x_t. Given s_0 = 2, w = 1, and x = [ 2 2 0 ] what is s_3?
What is s_3 if s_0 is 1.5, w is 0.1, and x is [ 2 2 0 ]?	We define an RNN as s_t = w * s_t-1 + x_t. What is s_3 if s_0 is 1.5, w is 0.1, and x is [2 2 0]?	Should every RNN be s_t=w or s_t-1 +x_t? What would be s_3 if w is 0.1 or 1.5 and x is [2 2 0]?	We define an RNN as w * s_t-1 + x_t. What is s_3 if s_0 is 1.5 or w is 0.11 and x is '2 0'?	I would like RNN for s_t = w * s_t-1 + x_t. What is s_3 if s_0 is 1.5, w is 0.1, and x is [ 2 2 0 ]?
Let s_0 be 0, w be 1, and x be [ 2 2 0 ]. Compute s_3 if s_t is w * s_t-1 + x_t.	Let s_0 be 0, and w be 1, and x be [ 2 2 0 ]. Compute s_3 if s_t is w * s_t-1 + x_t.	Let s_0 be 0, w be, and x be [ 2 2 0 ]. Compute s_3if s_t is w * s_t-1 + x_t. Does x represent what s_2?	Let s_0 be 0, w be 1 and x be [ 2 2 0]. Compute s_3 if s_t is w * s_t-1 + x_t.	Let s_0 be 0, w be 1, and x be [ 2 2 0 ], e.g. compute s_3, if s_t is w + s_t-1 + x_t. If w is of w, compute s_3.
How do you calculate the entropy of the left side of a region if there are 48 points in total?	The left side of region has 48 points. Of the 24 points, two are classified as positive. What is the entropy of the left region if there are 48 points in total?	The left side of a region has 24 points. Of the 24 points, 2 are classified as positive. What is the entropy of the left region if there are 48 points in total?	How would the left side of a region be evaluated if there were 48 points in total?	What is the left-side entropy of a region if 48 points are in total?
Given 44 points on a plane, 25 of them are on the right side of a line, and 3 of them that are on the left side are positive.Compute the entropy of the left side.	If 44 points are on a plane, 25 of them are on the left side of a line, and 3 of them are on the left side, which is the opposite point, compute the entropy for the left side.	Given 44 points in a plane, 15 of them are on the right side of a line, and 3 of them that are on the left side are positive. Compute the entropy of the left side. You can also write a full length of the line without checking the right axis.	Given 44 points on a plane, 25 of them are on the right side of a line, and 3 of them that are on the left side are positiv. Compute the entropy of the left side of the line, if ten of them are on the right side of the plane, and 20 of them are on the right side of a line.	Given 44 points on a plane, 25 of them are on the right side of a line, and 3 of them that are on the left side are positive-, calculate the entropy of the left side.
When there are 45 points on a 2D plane, 24 of them on the right side split by a line, and 3 points on the left side that are positive, what is the entropy of the left region?	Where are 45 points in a 2D plane, of which 24 are on the right side divided by a line and 3 are positive, what is the entropy of left region in real time?	What is the entropy of the left region up? If there are 45 points on a 2D plane, 24 firmly in the right side, but 2 on the left side that are independent of the right side, what is an entropy?	If there are 45 points on a 2D plane, 24 of them on the right side split by a line, and 3 points on the left side that are negative, what is the entropy of the left region?	If there is 45 points on a 2D plane, 24 of them are in the bottom left, and 3 are in the left center, what is the entropy of the left side?
A left region has 4 points classified as positive. There are 44 points in the plane, and 24 points on the left. Compute the entropy.	A left region has 4 points classified as positive. There are 44 points, and 24 points on the right, respectively.	A left region has 4 points classified as positive factors. There are 44 points in the plane and 24 points on the left. Compute the entropy.	A right region has 4 points classified as positive. There are 44 points in the plane, and 24 points on the left. Compute the entropy.	The left region of a planar plane with 4 points classified as positive and the right 24 points. Compute the entropy.
On a 2D image, there are 46 points and the positions 26 and 23 on the right side of the image. The rest is left. What is the entropy of the image to the left of rD?	In a 2D plane there are 46 points, 26 on the right side of a line and the rest on the left side. 3 points on the left of the line are positive. What is the entropy of the left region?	What is the entropy of the left edge of a straight line?	There are 46 points on a 2D plane, 26 on the right side of a line and the rest on the left. 3 points on the left of the line are positive. What is the entropy of the left region?	There are 46 points in two-dimensional planes in the Earth's orbit, 26 on the right side of the line, and the rest on the left. 3 points on the left of the line are positive. What is the topology of the Left region?
If 28 points are on the left side of a plane, 4 points on the right side are positive and the entropy is the entropy of the left side is the entropy of the plane. Compare the two planes and learn to mean that they have similar numbers.	What's the position of the points on the left side and its area in algebra?	Is the left side or the right side of a plane mean entropy?	Which plane of 48 points is left and his entropy to the right and what is the left and why?	Consider a plane of 54 points, 25 of which are on the left side. Of the points on the left, 4 points are positive. Calculate the entropy of the left side.
What is the entropy of 5 points on the right side of the plane when a 45 point plane looks over the left side.?	What is the entropy of the right side of a region containing 25 points where the system has 45 points in total and two points on the left are positive?	What is the entropy of the left side of a region containing 25 points where the plane has 45 points but 2 points on the left are positive here?	What is the entropy of the left side of a region containing 25 points, where the plane has 45 points in total and 2 points on the left are positive?	What is the right side entropy of a plane with 45 points in total and 2 points on the left are positive?
Is the entropy of the left point a classification of a plane with a 1D line?	If there are 44 points on a 2D plane, on total 44 points, 24 (the wrong side) are classed (positive) and 1 (the wrong side) is an entropy, how is the left region classified?	Consider a 1D classification line on a 2D plane in 2D space. There are 44 points, 24 of which are on the right and the rest on the left of the boundary. 1 points on the left are classified positive.What is entropy of the left region?	What is the entropy of the left region of the 1D layer on a 2D plane. There is a total of 44 points, 24 of which are on the right of the boundary and the rest on the left of the boundary. What is the entropy of the left region?	Suppose a 1D classification line on a 2D plan. There is a total of 44 points, 24 of which are on the right and rest on the left of the boundary.1 points on the left are classified positive. What is the entropy of the left region?
If a region is 26 points on the left and 48 points total. 2 points on the left are negative. Compute the entropy.	If a region has 26 points on the left and 48 points total. 2 points that are on the right are true. Compute the entropy..	Do the points on the left in the entropy below the region get greater than the.2 point on the left?	If a region has 26 points on the left and 48 points total. 2 points that are on the left are negative. Compute the entropy in the physics.	If a region has 26 points on the left and 48 points total. 2 points on the left are negative. Calculate the entropy.
Calculate the entropy of the right region of a 2D plane, divided by a line. There are 1 points on the left side that are positive, 25 points on the right side, and 44 points total.	Calculate the entropy of the left region of a 2D plane, split by a line. There are 2 points on the right side that are positive, 25 points on the left side, and 44 points total.	Calculate entropy of the left region of a 2D plane divided by a line. There are 1 points on the left side that are positive and 25 points on the right side. and 44 points total.	Calculate the entropy of the left region of a 2D plane, split by a line. There are 1 points on the left side that are positive, 25 points on the right side, and 44 points total.	Calculate the entropy of the left region of a 2D plane, split by a line.There are 1 points on the right side that are positive, 25 points on the right side, and 44 points total.