With lambda = 0.5, the optimal theta is 1. If the datapoints are [ ( 0-1 ), ( 1 negative 2 ), ( 2 y ), what is the value of y? The optimal theta is computed by mean squared error.	What is the optimal theta with lambda = 0.5? If your datapoint is [(0 1 ), (0 negative 2 ), ( 2 y ) ), can you explain the y?	With lambda = 0.5, the optimal theta is 1. If the datapoints are [ ( 0 1 ) ), (1 positive 2 ), ( 2 y ) ), what is the value of y? The optimal theta is computed by mean squared error.	With lambda = 0.5, the optimal theta is 1. If the datapoints are [ ( 0 1 ), ( 1 negative 2 ), ( 2 y ) ]what is the value of y? The optimal theta is computed by mean squared error?	When lambda = 0, the optimal theta is 1. If the datapoints are [ (0 1 ), [ 1 negative 2 ), ( 2 y ) ( ( 2 y ) )], what is the value of y? The optimal theta is computed by mean squared error.
What is the meaning of f(theta)?	f(theta) is defined as 9 times theta plus 19 squared. When f(theta) is 0, you get the result. What is f(theta)? Is it an amatrice?	Of all maths, theta is said to be 9 times theta plus 19 squared, and theta is 1. What is f(theta)?	What is f(theta)?	Theta (theta) is defined as 9 times theta plus 19 squared and theta which is 1. What is f(theta)?
If we let theta be 0 and lda be 1 what is the mean squared error for 2 1 and 5?	Determining the mean squared error of the given points ( ( 2 1 ) and 1 5 ) if we let theta be 0 and lda be 1?	If we let theta be 0 and lda be 1, what is the mean squared error of the given points [ ( 2 1 ) and ( 1 5 )_?	If we let theta be 0 and lda be 1, what is the mean squared error of the given points [ ( 2 1 ) ) and ( 1 5 ) )?	If we let theta be 0 and lda be 1, what is the mean squared error of the given points?
Given a dataset [ ( 0 0 ), ( 1 negative 2 ), ( 2 y ) ], we get that the mean squared error for a theta = 2 is minimal. What does y need to be if lambda is 0.5?	Given the dataset [ ( 0 0 ), ( 1 negative 2 ), ( 2 y ) ], we get that the mean squared error of a theta = 2 is minimum is what does y need to be if lambda is 0.5?	Given a dataset [ ( ( 0 0 ), ( 1 negative 2 ), ( 2 y ) ], we get that the mean squared error for a theta = 2 is minimal. What does y need to be if lambda is 0.35?	Given the dataset [( ( 0 0 ), ( 1 negative 2 ), ( 2 y ) ], we get that the mean squared error for a theta = 2 is minimal. What does y need to be if lambda is 0.5?	Given the dataset [ ( 0 0 ), ( 1 negative 2 ), ( 2 y )], we get that the mean squared error for a theta = 2 is minimal. What does y need to be if lambda is 0.05?
Let 1 be the optimal theta by mean squared error. Given the datapoint for (( ( ( 1 ) ), (2 y ) ) and lambda is 0.5, compute Y by mean Squared ERR..	Let 1 be an optimal Theta. Given the datapoints [ (( 0 or zero), ( 1 one), ( 2 y), ( 0.5 ), calculate the value at the end of the computation. y is the average squared error and the value at the end of the computation].	Let 1 be the optimal theta by means squared error. Given the datapoints [ 0 negative 2 ), ( 1 1 ), ( 2 y ), ( a), b), and lambda is 0.5, compute the value of y.	Let 1 be the optimal theta by mean squared error. Given the datapoints [ ( 0 negative 2 ), ( 1 1 ), ( 2 y ) ] and lambda is 0.57, compute the value of y.	Let 1 be the optimal theta by mean squared error. Given the datapoints [ ( ( 0 negative 2 ), ( 1 1 ) % 0 ( 2 y ), and lambda is 0.5 )] and lambda is 0.5, compute the value of y.
Given theta = 3 and lda = 1, compute the mean squared error with the data points and log(2 (0)0 0 0 0 0   5  2 0   0  )  :,iiia = 3 and lda = 1 (iv f- 1) : + 3 + 1 >1 + 5 +  )	In conjunction with theta = 3 and lda = 1, compute the mean squared error with the data points [ ( 2 negative 2) and ( 1 5 )], then enumerate all expected changes.	What is the mean square error given by theta =3 and lda =1??	What is mean squared error and lda=1 for theta = 3 and lda = 1, is 1 5 and 2 2 0?	Given theta =3 and lda =1, compute the mean squared error with the data points [ ( 2 negative 2 ) and [ 1 5 ) ]......... (=1. 5).
A neural network has inputs x1 = 1 with weight 2 and x2 = 4 with weight 1 and offset value oA = 0.5. Neuron B inputs x2 with offset 1. Neuron C takes in the output of neurons A and B with offsets wAC = 1 and wBC = 3, respectively. Neuron C has offset value oC = 5. Compute the output.	A neural network has inputs x1 = 1 with weight 2 and x2 = 4 with weight 1 and offset value oA = 0.5. Neuron A inputs x2 with offset 1. Neuron C takes in the output of neurons A and B with offsets wAC = 1 and wBC = 3, respectively. Neuron C has offset value oC = 5. Compute the output.	A neural network inputs x1 = 1 with weight 2 and x2 = 4 with weight 1 and offset value oA = 0.5. Neuron D inputs x2 with offset 1. Neuron A is the input mode; A is the offset mode; Brain C is the input mode; Brain C is the output mode; Brain C is the output mode; C is the offset mode; Brain C is the output form; and the output is the output.	A neural network has inputs x1 = 1 with weight 2 and x2 = 4 with weight 1 and offset value oA = 0.5. Neuron B inputs x2 with offset 1. Neuron C takes in the output of neurons A and B with offsets wAC = 1 and wBC = 3. Neuron C has offset value oC = 5. Compute the output.	A neural network has inputs x1 = 1 with weight 2. and x2 = 4 with weight 1 and offset value oA = 0.5. Neuron B inputs x2. takes in the output of neurons A and B, with offsets wAC = 1 and wBC = 3, respectively. Neuron C has offset value oC = 5. Compute the input
How many weights ( including biases ) are there as one layer in a fully connected feedforward network?	How many maximum/minimal weights are there in a fully connected feedforward network which has 40 inputs and 70 outputs? How many are there for each layer?	How many weights ( including biases ) are there for a single layer with 40 inputs and 70 outputs?	In a fully connected feedforward network, how many weights are there, including biases?	In a fully connected feedforward network, how many weights (including biases ) are there for one layer with 40 inputs and 70 outputs?
Is there a weight and a set of 10 inputs and 2000 outputs in a neural network with biases?	Which is the total weight in neural network? If we add biases there would be 15 inputs and 400 outputs?	In a neural network, here it is fully connected and Feedforward but not commingling with the inputs and outputs, how many total weights are there?	What is the weighting in a neural network? How many inputs and 200 outputs are there?	For a fully connected and feedforward, how many total weights are there if we include biases? We have 10 inputs and 200 outputs. What should I think of doing?
If we have 15 inputs and 150 outputs, count the total number of weights including biases with a neural network. Given a feedforward neural network, compute the total number of weighs including bias and find a graph with a graph.	Given a feedforward neural network layer, compute the total number of weights including biases when we have 150 outputs and 40 inputs.	Given a feedforward neural network layer, compute the total number of weights including biases if we have 150 outputs and 40 inputs.	If we have 100 inputs and 150 outputs, what is the weights of the feedforward neural network?	Given a feedforward neural network layer, compute the total number of weights including bias if we have 150 inputs and 40 outputs.
If we have a neural network layer with 30 input and 50 outputs, how many weights ( including biases ) are needed to describe each connection?	Can there be null weights in the neural network, as 70 inputs and 100 outputs are needed to describe each connection used for?	If we have a neural network layer with 20 inputs and 50 outputs, how many weights are needed to describe each connection?	If we have a neural network layer with 30 inputs and 50 outputs, how many weights are needed to describe each connection?	If we have 50 inputs and 30 outputs, how many weights are needed to describe each connection?
Neuron A and Neuron C are the input and output of a neural network. Neuron A takes in value x1 is 1 with weight w1 being 1 and offset value oA being 0.5 with weight wOA being 1. Neuron C takes in the output of neuron A in weight wAC being 1 and offset value oC being 4 with weight wOC being 2. Can it really be really useful?	Neurons A and C are the input and output neurons of a neural network. Neuron A takes in value x1 is 1 but offset value oA is 0.5 with weight wOA being 1. Neuron C takes in output of neurons A with weight wAC being 1 and offset value oC being 4 with weight wOC being 2. What is the output of neurons C? Why is it important?	Is there a relationship between the input and output neurons of a neural network? What is the output of neuron A?	Neuron A and Neuron C are input and output neurons of a neural network. Which is the alternative one?	Neuron A and Neuron C are the input and output neurons of a neural network. Neuron A takes in value x1 is 1 with weight w1 being 1 and offset value oA being 0.5 with weight wOA being 1. Neuron C takes in the output of neuron A with weight wAC being 1 and offset value oC being 4 with weight wOC being 2. What is the output of neuron C?
Neuron A takes in value 1 with weight 1 and offset 0.5. Its output is passed into neuron C with weight 1. Neuron B takes in value 0 with weight 1 and offset 1. Its output is passed into neuron C with weight 3. Compute the output of this neural network.	Neuron A takes in values 1 without weight 1and offset 0.5. Its output is passed into neuron C with weight 1. Neuron B takes in value 1 with weight 1 and offset 1. Its output is passed into neuron C with weight 3. Compute the output of this neural network.	Neuron A takes in value 1 with weight 1 and offset 0.5. Its output is passed into neuron C with weight 1. Its output is passed into neuron C with weight 3. Compute the output of this neural network.	Data is passed to Neuron B with offset 1. Data from this network is output into C with offset.C which has offset 3.Complete the output of this neural network with output.The output of this neural network is computed by computing the output signal of this neural network or by means of an algorithm other than weight 1 and 2.Data is normally passed to Neuron C with offset 1.Data is not passed into the neural network.Do not pass input into the neural network by means of other methods.	Nilea takes in value 1 with weight 1 and offset 0.5. The output is passed into neuron C with weight 1. Neuron C takes in value 1, offset and take in weight 3. Compute the output of this neural network.
Neurons A and B take inputs 1 and 1 with weights 2 and 1, respectively. Neuron A has offset 0.5, and neuron B has offset 1. Neuron C takes in the output of A and B with weights 1 and 3, respectively, and with offset 2. What is the output?	O 1 No one has offset 0.5, Neuron B 1 Noone C takes in the input of A and B with weights 1 and 3, respectively, and with offset 2 No One is unable to take in the output. How can this output be calculated with any number?	Neurons A and B take inputs 1 and 1 with weights 2 and 1, respectively. Neuron A has offset 0.5 and neuron B has offset 1. Neuron C takes in the output of A and B with weights 1 and 3, respectively, and with offset 2. What is the output?	Neurons A and B take inputs 1 and 1 with weights 2 and 1, respectively. Neuron A has offset 0.5 and neuron B has offset 1. Neuron C takes in the output of A and B with weights 1 and 3, respectively, and with offset 2. What is this output?	Neuron A and B take inputs 1 and 1 with weights 2 and 1, respectively. Neuron A has offset 0.5 and neuron B has offset 1. Neuron C takes in the output of A and B with weights 1 and 3 and with offset 2. What are the results?
A fully connected neural network has 120 outputs and 20 inputs. How many total weights are there including the biases in it?	Is there a neural network capable of training 120 inputs and 90 outputs?	When looking at the total weights of a fully connected neural network, how many are there?	A fully-connected neural network has 120 outputs and 20 inputs. How many total weights are there including biases and loops?	A fully-connected neural network has 120 outputs. How many total weights are there including the biases?
Compute the outputs from neuron C, which takes in outputs from neurons A with weight wAC = 1 and B with weight wBC = 3 and offset oC = 5. Neuron A takes in value x1 = 1 with weight w1 = 2 and offset value oA = 0.5. Neuron B takes in input x2 = 2 with an offset of 1.	Compute the output of the neuron C, which takes in outputs from neurons A with weight wAC = 1 and B with weight wBC = 3 and offset oC = 5. Neuron A takes in value x1 = 1 with weight w1 = 2 and offset value oA = 0.5, Neuron B takes in input x2 = 2 with an offset of 1.	Compute the output of neuron C, which takes in outputs from neurons A with weight wAC = 1 and B with weight wBC = 3 and offset oC = 5. Neuron A takes in value x1 = 1 with weight w1 = 2 and offset value oA = 0.5. Neuron B takes in input x2 = 2 with an offset of 1.	Compute the output of neuron C. which takes in outputs from neurons A with weight wAC = 1 and B with weight wBC = 3 and offset oC = 5. Neuron A takes in value x1 = 1 with weight w1 = 2 and offset value oA = 0.5. Neuron B takes in input x2 = 2 with an offset of 1.	Compute the output of neuron C which takes in outputs from neurons A with weight wAC = 1 and B with weight wBC = 3 and offset oC = 5. Neuron A takes in value x1 = 1 with weight w1 = 2 and offset value oA = 0.5. Neuron B takes in input x2 = 2 with an offset of 1.
In a neural network, neuron A outputs the sum of x1 times w1 and oA times wOA and neuron C outputs the ReLU of the sum of the product between the input from neuron A and wAC and the product between oC and wOC. What is the output of neuron C if we are given that x1 is negative 1, w1 is 1, oA is 0.5, wOA is 2,	In a neural network, neuron A outputs the sum of x-1 times w1 and oA times wOA and neuron C outputs the ReLU of the sum of the product between the input from neuron A and wAC and the product between oC and wOC. What is the output of neuron C if we are given that x1 is negative 1, w1 is 1, oA is 0.5, wOA is 2,	What is the output of neuron C if we are given that x1, the first zero, the first zero, the second zero and the third zero is the input from neuron A, and the third zero is the input from neuron A. In a neural network, Neuron A outputs the sum of x1 times w1, of o and oA times wOA and neuron C outputs the ReLU of the sum of the product between the input from neuron A and oA and the	In neural network neuron A outputs the sum of x1 times w1 and oA times wOA and neuron C outputs the ReLU of the sum of the product between the input from neuron A and wAC and the product between oC and wOC. What is the output of neuron C if we are given that x1 is negative 1, w1 is 1, oA is 0.5, wOA is 2, w AC is	In a neural network, neuron A outputs the sum of x1 times w1 and oA times wOA and neuron C outputs the ReLU of the product between the input from neuron A and wAC and the product between oC and wOC. What is the output of neuron C if we are given that x1 is negative 1, w1 is 1, oA is 0.5, wOA is 2, wAC
Neuron A takes in value negative 1 with weight 2 and offset 0. Its output is passed into neuron C with weight 1. Neuron B takes in value 1 with weight 1 and offset 1. Its output is passed into neuron C with weight 2. Compute the output of this neural network.	Neuron A takes in value negative 1 with weight 2 and offset 0.5. Its output is passed into neuron C with weight 1. Neuron B takes in value 1 with weight 1 and offset 1. Its output is passed into neuron C with weight 2. Compute the output of this neural network.	The output of neuron A is passed to neuron B as follows: neuron C has offset 5 and RELU on its output. Compute the output of this neural network with a sine wave in the output.	Neuron A take in value negative 1 with weight 2 and offset 0.5. Its output is passed into neuron C with weight 1. Neuron B takes in value 1 with weight 1 and offset 1. Its output is passed into neuron C with weight 2. Neuron C has offset 5. Compute the output.	Neuron C takes in value negative 1 with weight 2 and offset 0.5. Its output is passing into neuron C with weight 2. Neuron C has offset 5 and a ReLU on its output. Computes output to neuron C with weight 1.
A neural network has input x1 with weight w1 which goes into neuron A. Neuron A also has input oA that has weight wOA. Neuron C inputs the output of neuron A with weight wAC. Neuron C has also has input oC that has weight wOC.	A neural network has input x1 with weight w1 that goes into neuron A. Neuron A also has input oA that has weight wOA that goes into neuron B. Neuron C inputs the output of neuron A with weight wAC. Neuron C has also has input oC that has weight wOC as what is the output of neuron C if x1 is negative, w1 is 2, oA is 0.5, wOA	A neural network goes into neuron A. Neuron A also has input oA that is weight wOA. Neuron C inputs the output of neuron A with weight wAC. Neuron C applies a reLU on its output. What is the output of neuron C if x1 is negative 1, w1 is 2, oA is 0.5, wOA is 0, wAC is 1, oC is 5	A neural network has input w1 that goes into neuron A. Neuron A also has input oA that has weight wOA. Neuron C inputs the output of neuron A with weight wAC. Neuron C has also has input oC that has weight wOC. What is the output of neuron C if x1 is negative 1, w1 is 2, oA is 0.5, wOA is 0, wAC is	A neural network has input x1 with weight w1 that goes into neuron A. Neuron A also has input oA that has weight wOA. Neuron C inputs the output of neuron A with weight wAC. Neuron C has also has input oC that has weight wOC. Which of Neuron C's systems has impacted the normal function of neural network A?
Neuron C takes in weight wAC being 1 and offset value oC being 5. Similarly, offset weight wOC is 2 and is a ReLU function. Find function output from neural network.	We all know the output of neural coding: an offset of 0 or 10 and an offset weight wOA of 2 or 3. The output is passed to neuron A. Each decoding gets an offset value of 0 or 5. Each decoding also takes a weight wOC of 2. This input field is simulated with ReLU. Find the output of a neural network.	The output should be x1 with weight wAC, and input x1 with weight w1 being two. The output is passed to neuron C. Find an output of the neural network.	Neuron A with an offset value oA being 0.5, an offset weight wOA being 2, and an input x1 being negative 1 with weight w1 being 2. The output of neuron A is passed to neuron C, which takes it in with weight wAC being 1. Neuron C Also takes in offset value oC being 5 and offset weight wOC being 2 and applies a ReLU function. Find the output of neural network. Find the output of the neural	The output of neuron A is passed to neuron C, which takes it in with weight wAC being 1. neuron C also takes in offset value oC being 5 and offset weight wOC being 2 and applies a ReLU function. Find the output of the neural network.
Neuron C is the output neuron which applies a ReLU on its output and neuron A is an input neuron to a neural network with the given architecture and inputs. Compute the output of a neural network with the given architecture with inputs. Neuron C takes in the offset value oC being 2 with weight wOC being 2. Neuron C takes in the output of neuron A with weight wAC being 1. Neuron A takes in the input value x1 being negative 1	Neuron C is the output neuron which applies a ReLU on its output and neuron A is the input neuron to compute the output of a neural network. Compute the output of a neural network with the given architecture and inputs. Neuron C takes in an offset value of 2 with weight wOC being 2. Neuron C takes in the output of neuron A with weight wAC being 1. Neuron A takes in an input value x1 being negative 1 with weight w1	Constantly, the inputs and outputs of a neural network are set to C and A as per the rules in a ReLU program. To compute the output of a neural network. Neuron C takes in an offset value of 2 with weight wOC being 2. Neuron A takes in the output of neuron A with weight wAC being 1. Neuron A takes in an input value x1 being negative 1 with weight w1 being 2 and offset value oA being 0.5 and	Neuron C is the output neuron which applies a ReLU on its output and neuron A is the input neuron to a neural network and takes an input of input for computation. Neuron C is the offset neuron with weight wOC being 2 and Neuron C takes in input of Neuron A with weight wAC being 1.	Neuron C is the output neuron which applies a ReLU on its output and Neuron A is the input neuron to a neural network. Compute the output of a neural network with the given architecture and inputs. Neuron C takes in an offset value oC being 2 with weight wOC being 2. Neuron C takes in an output of neuron A with weight wAC being 1. Neuron A takes in an input value x1 being negative 1, with weight w1 being
A neural network has inputs x1 = negative 1 with weight 1 and x2 = 3 with weight 1 and offset value oA = 0.5. Neuron B inputs x2 with offset 1. Neuron C takes in the output of neurons A and B with offsets wAC = 1 and wBC = 2, respectively. Neuron C has offset value oC = 1, Compute the output.	A neural network has inputs x1 = negative 1 with weight 1 and x2 = 3 with weight 1 and offset value oA = 0.5. Neuron B inputs x2 with offset 1. Neuron C takes in the output of neurons A and B with offsets wAC = 1 and wBC = 2, respectively. Neuron C has offset value oC = 1 and applies an ReLU on its output. Compute the output.	A neural network has inputs x1 = negative 1 and x2 = 3 with weight 1 and offset value oA = 0.5. Neuron A inputs x2. Neuron C takes in the output of neurons A, B with offsets wAC = 1 and wBC = 2. Neuron C has offset value oC = 1 and applies ReLU. Compute the output.	A neural network has inputs x1 = negative 1 with weight 1 and x2 = 3 with weight 1 and offset value oA = 0.5. Neuron B inputs x2 with offset 1. Neuron C takes in the output of neurons A and B with offsets wAC = 1 and wBC = 2, respectively. Neuron C has offset value oC = 1 and applies the ReLU on its output. Compute the output.	A neural network has inputs x1 = negative 1 with weight 1 and x2 = 3 with weight 1 and offset value oA = 0.5. Neuron B inputs x2 with offset 1. Neuron C takes in the output of neurons A and B with offsets wAC = 1 and wBC = 2, respectively. Neuron C has offset value oC = 1 and applies an ReLU on the output. Compute the output.
Neurons A and B take inputs negative 1 and 3 with weights 2 and 1, respectively. Neuron A has offset 0.5 and neuron B has offset 1. Neuron C takes in the output of A and B with weights 1 and 3 and with offset 2, it also applies a ReLU to its output. What is the output (c)?	Neurons A and B take inputs negative 1 and 3 with weights 2 and 1 respectively. Neuron A has offset 0.5 and Neuron B has offset 1. Neuron C takes in the output of A and B with weights 1 and 3, respectively, and with offset 2. Neuron C also applies a ReLU on its output. What is the output?	Neuron A and B take inputs negative 1 and 3 with weights 2 and 1 respectively. Neuron A has offset 0.5, Neuron B has offset 1. Neuron C takes in output of A and B with weight 1 and 3, respectively, and with offset 2. Neuron C also applies a ReLU on its output. What is the output?	Neuron C takes in the inputs of A and B with weights 1 and 3, respectively, and with offset 2. Neuron C applied the ReLU on its output. What is the output?	Neurons A and B take inputs negative 1 and 3 with weights 2 and 1 respectively. Neuron B has offset 0.5 and neuron A has offset 1. Neuron C takes in the output of A and B with weights 1 and 3, respectively, and with offset 2. Neuron C also applies a ReLU on its output. What is the output?
Compute the ReLU output of neuron C which takes the output of neuron B and ___ A with weights 2 and offset 3. Neuron B has input 0 (cognition) and offset 1 (nicolinin) in your memory.	Compute the ReLU output of neuron C which takes the output of neuron A with weight 1 and neuron B with weight 2 and offset 3. Neuron B has input 0 and offset 1. Neuron A has input negative 1 and offset 1 with offset 0.5.	Compute the ReLU output of neuron C which takes the output of neuron A with weight 1 and ton B with weight 2 and offset 3. Neuron B has input 0 and offset 1. Neuron A has input negative 1 and offset 1 with offset 0.6.	Compute the ReLU output of neuron C which takes the output of neuron A with weight 1 and neuron B with weight 2 and offset 3. Neuron B has input 1 and offset 1. Neuron A has input negative 1 and offset 1 with offset 0.5.	Compute the ReLU output of N in C which takes the output of neurons A with weight 1 and neuron B with weight 2 and offset 3. Neuron B has input 0 and offset 1. Neuron A has input negative 1 and offset 1 with offset 0.5.
